{
  "$schema": "../.kai/schema/credits.json",
  "title": "Fjord Town",
  "byline": "A portfolio by Thomas Lekanger",
  "sections": [
    {
      "heading": "Built with",
      "lines": [
        "Next.js, React, Phaser, ink, Geist"
      ]
    },
    {
      "heading": "Art",
      "lines": [
        "LimeZu (limezu.itch.io)",
        "Modern Exteriors, Modern Interiors,",
        "Modern Office, Modern User Interface"
      ]
    },
    {
      "heading": "Type",
      "lines": [
        "Geist Pixel by Vercel",
        "(SIL Open Font License)"
      ]
    },
    {
      "heading": "Music",
      "lines": [
        "Towball's Crossing: Deluxe!",
        "by Towball (towball.itch.io),",
        "CC BY 4.0"
      ]
    },
    {
      "heading": "Sound",
      "lines": [
        "Made in code with Web Audio"
      ]
    },
    {
      "heading": "Code",
      "lines": [
        "GPL-3.0 on GitHub",
        "datagutt/datagutt.no"
      ]
    }
  ],
  "thanks": "Thanks for visiting."
}
